,movie_id,title,runtime,certificate,imdb_rating,year,votes,summary,user_review,critic_review,language,country,budget,gross,opening_week,oscar_win,oscar_nom,other_win,other_nom,meta_score,Crime,Drama,Thriller,Comedy,War,Action,Adventure,Sci-Fi,Western,Biography,Horror,Fantasy,Romance,Mystery,Family,History,Music,Animation,Sport,Musical,Film-Noir,Documentary,News,Short
710,tt0020629,All Quiet on the Western Front,152.0,Unrated,8.0,1930,55806,A young soldier faces profound disillusionment in the soul-destroying horror of World War I.,238,102,English,USA,1200000,6880917,0,2,0,5,2,91.0,0,1,0,0,1,0,0,0,0,0,0,0,0,0,0,0,0,0,0,0,0,0,0,0
711,tt8413338,Kumbalangi Nights,135.0,Unrated,8.6,2019,6425,"The film revolves around four brothers who share a love-hate relationship with each other. Their relationship progresses to another level when Saji, Boney, and Franky decide to help Bobby stand by his love.",123,16,Malayalam,India,10000000,6880917,0,0,0,0,1,51.87179487179487,0,1,0,1,0,0,0,0,0,0,0,0,1,0,0,0,0,0,0,0,0,0,0,0
712,tt0052311,Touch of Evil,95.0,PG-13,8.0,1958,96070,"A stark, perverse story of murder, kidnapping, and police corruption in a Mexican border town.",315,113,English,USA,829000,2247465,70725,0,0,7,1,99.0,1,1,0,0,0,0,0,0,0,0,0,0,0,0,0,0,0,0,0,0,1,0,0,0
713,tt7485048,Super 30,154.0,Unrated,8.0,2019,17925,Based on the life of Patna-based mathematician Anand Kumar who runs the famed Super 30 program for IIT aspirants in Patna.,575,22,Hindi,India,10000000,2269878,871256,0,0,5,9,51.87179487179487,0,1,0,0,0,0,0,0,0,1,0,0,0,0,0,0,0,0,0,0,0,0,0,0
714,tt0044741,Ikiru,143.0,Unrated,8.3,1952,63914,A bureaucrat tries to find a meaning in his life after he discovers he has terminal cancer.,210,124,Japanese,Japan,10000000,60239,2149,0,0,5,1,51.87179487179487,0,1,0,0,0,0,0,0,0,0,0,0,0,0,0,0,0,0,0,0,0,0,0,0
715,tt10717738,Anjaam Pathiraa,144.0,Unrated,8.0,2020,2902,"The police are on the trail of a serial killer, but with the victims being fellow officers, will they be able to catch the killer and solve the case in time?",114,5,Malayalam,India,10000000,6880917,0,0,0,0,0,51.87179487179487,1,0,1,0,0,0,0,0,0,0,0,0,0,1,0,0,0,0,0,0,0,0,0,0
716,tt0423866,3-Iron,88.0,R,8.0,2004,47954,A transient young man breaks into empty homes to partake of the vacationing residents' lives for a few days.,135,180,Korean,"South Korea, Japan",1000000,241914,20084,0,0,15,9,72.0,1,1,0,0,0,0,0,0,0,0,0,0,1,0,0,0,0,0,0,0,0,0,0,0
717,tt0057565,High and Low,143.0,Unrated,8.5,1963,29405,An executive of a shoe company becomes a victim of extortion when his chauffeur's son is kidnapped and held for ransom.,119,89,Japanese,Japan,10000000,46808,15942,0,0,3,2,51.87179487179487,1,1,0,0,0,0,0,0,0,0,0,0,0,1,0,0,0,0,0,0,0,0,0,0
718,tt3863552,Bajrangi Bhaijaan,163.0,Unrated,8.0,2015,68651,An Indian man with a magnanimous heart takes a young mute Pakistani girl back to her homeland to reunite her with her family.,313,56,Hindi,India,10000000,8178001,2425000,0,0,27,16,51.87179487179487,0,1,0,1,0,1,0,0,0,0,0,0,0,0,0,0,0,0,0,0,0,0,0,0
719,tt1865505,Song of the Sea,93.0,PG,8.1,2014,48387,"Ben, a young Irish boy, and his little sister Saoirse, a girl who can turn into a seal, go on an adventure to free the fairies and save the spirit world.",122,162,English,"Ireland, Denmark, Belgium, Luxembourg, France",5300000,857522,21910,0,1,11,24,85.0,0,1,0,0,0,0,1,0,0,0,0,0,0,0,0,0,0,1,0,0,0,0,0,0
720,tt0374546,"Spring, Summer, Fall, Winter... and Spring",103.0,R,8.0,2003,74777,A boy is raised by a Buddhist monk in an isolated floating temple where the years pass like the seasons.,186,68,Korean,"South Korea, Germany",10000000,2380788,42561,0,0,15,8,85.0,0,1,0,0,0,0,0,0,0,0,0,0,1,0,0,0,0,0,0,0,0,0,0,0
721,tt1773764,Ship of Theseus,140.0,Unrated,8.0,2012,6213,"The film explores questions of identity, justice, beauty, meaning and death through an experimental photographer, an ailing monk and a young stockbroker.",69,30,English,"India, Netherlands",12000000,6880917,0,0,0,12,10,51.87179487179487,0,1,0,0,0,0,0,0,0,0,0,0,0,0,0,0,0,0,0,0,0,0,0,0
722,tt7881550,Har Kisse Ke Hisse: Kaamyaab,109.0,Unrated,8.0,2018,2522,"Sudheer is an actor from the heyday of Bollywood. Years after his retirement, he realizes that he 'retired' on the verge of accomplishing a unique record. He decides to come out of his retirement to complete the round figure of 500.",69,7,Hindi,India,10000000,6880917,0,0,0,3,0,51.87179487179487,0,1,0,0,0,0,0,0,0,0,0,0,0,0,0,0,0,0,0,0,0,0,0,0
723,tt9052870,Chhichhore,143.0,Unrated,8.0,2019,18255,Following a group of friends from university as they progress into middle-age life and go their own separate ways.,469,16,Hindi,India,10000000,2004400,614335,0,0,3,13,51.87179487179487,0,1,0,1,0,0,0,0,0,0,0,0,0,0,0,0,0,0,0,0,0,0,0,0
724,tt0169102,Lagaan: Once Upon a Time in India,224.0,PG,8.1,2001,100838,The people of a small village in Victorian India stake their future on a game of cricket against their ruthless British rulers.,275,77,Hindi,India,6000000,909043,285368,0,1,54,19,84.0,0,1,0,0,0,0,1,0,0,0,0,0,0,0,0,0,0,0,0,1,0,0,0,0
725,tt0055031,Judgment at Nuremberg,179.0,Approved,8.2,1961,66308,"In 1948, an American court in occupied Germany tries four Nazis judged for war crimes.",209,102,English,USA,3000000,6880917,0,2,0,14,25,60.0,0,1,0,0,1,0,0,0,0,0,0,0,0,0,0,0,0,0,0,0,0,0,0,0
726,tt0114787,Underground,167.0,Unrated,8.1,1995,53658,"A group of Serbian socialists prepares for the war in a surreal underground filled by parties, tragedies, love and hate.",145,47,Serbian,"Federal Republic of Yugoslavia, France, Germany, Bulgaria, Czech Republic, Hungary, UK, USA",14000000,171082,0,0,0,7,10,51.87179487179487,0,1,0,1,1,0,0,0,0,0,0,0,0,0,0,0,0,0,0,0,0,0,0,0
727,tt0169858,Neon Genesis Evangelion: The End of Evangelion,87.0,Unrated,8.1,1997,34898,Concurrent theatrical ending of the TV series Shin Seiki Evangelion (1995).,172,15,Japanese,Japan,10000000,6880917,0,0,0,2,0,51.87179487179487,0,1,0,0,0,1,0,0,0,0,0,0,0,0,0,0,0,1,0,0,0,0,0,0
728,tt2991224,Tangerines,87.0,Unrated,8.2,2013,36642,"In 1992, war rages in Abkhazia, a breakaway region of Georgia. An Estonian man Ivo has decided to stay behind and harvest his crops of tangerines. In a bloody conflict at his door, a wounded man is left behind, and Ivo takes him in.",77,121,Estonian,"Estonia, Georgia",650000,144501,5180,0,1,12,7,73.0,0,1,0,0,1,0,0,0,0,0,0,0,0,0,0,0,0,0,0,0,0,0,0,0
729,tt1562872,Zindagi Na Milegi Dobara,155.0,Unrated,8.1,2011,64111,Three friends decide to turn their fantasy vacation into reality after one of their friends gets engaged.,170,30,Hindi,India,550000000,3108485,960548,0,0,32,22,51.87179487179487,0,1,0,1,0,0,0,0,0,0,0,0,0,0,0,0,0,0,0,0,0,0,0,0
730,tt0040725,The Red Shoes,135.0,Unrated,8.1,1948,29291,A young ballet dancer is torn between the man she loves and her pursuit to become a prima ballerina.,171,113,English,UK,500000,6880917,0,2,0,4,7,51.87179487179487,0,1,0,0,0,0,0,0,0,0,0,0,1,0,0,0,1,0,0,0,0,0,0,0
731,tt0057091,The Leopard,186.0,PG,8.0,1963,22010,"The Prince of Salina, a noble aristocrat of impeccable integrity, tries to preserve his family and class amid the tumultuous social upheavals of 1860's Sicily.",106,112,Italian,"Italy, France",2900000000,6880917,0,0,1,10,5,100.0,0,1,0,0,0,0,0,0,0,0,0,0,0,0,0,1,0,0,0,0,0,0,0,0
732,tt8291224,Uri: The Surgical Strike,138.0,Unrated,8.3,2019,39669,"Indian army special forces execute a covert operation, avenging the killing of fellow army men at their base by a terrorist group.",938,17,Hindi,India,450000000,4186168,631146,0,0,17,24,51.87179487179487,0,1,0,0,1,1,0,0,0,0,0,0,0,0,0,0,0,0,0,0,0,0,0,0
733,tt0338564,Infernal Affairs,101.0,R,8.0,2002,115551,"A story between a mole in the police department and an undercover cop. Their objectives are the same: to find out who is the mole, and who is the cop.",212,177,Cantonese,Hong Kong,6428966,169659,25680,0,0,24,26,75.0,1,1,0,0,0,0,0,0,0,0,0,0,0,1,0,0,0,0,0,0,0,0,0,0
734,tt0347304,Kal ho naa ho,186.0,Unrated,8.0,2003,61069,"Naina, an introverted, perpetually depressed girl's life changes when she meets Aman. But Aman has a secret of his own which changes their lives forever. Embroiled in all this is Rohit, Naina's best friend who conceals his love for her.",136,56,Hindi,India,10000000,1991922,758211,0,0,40,41,54.0,0,1,0,1,0,0,0,0,0,0,0,0,1,0,0,0,0,0,0,0,0,0,0,0
735,tt0376968,The Return,110.0,Unrated,8.0,2003,40820,"In the Russian wilderness, two brothers face a range of new, conflicting emotions when their father - a man they know only through a single photograph - resurfaces.",192,114,Russian,Russia,10000000,504256,19795,0,0,32,17,82.0,0,1,0,0,0,0,0,0,0,0,0,0,0,0,0,0,0,0,0,0,0,0,0,0
736,tt0051459,Cat on a Hot Tin Roof,108.0,Unrated,8.0,1958,43270,"Brick Pollitt (Paul Newman), an alcoholic ex-football player, drinks his days away and resists the affections of his wife, Maggie (Dame Elizabeth Taylor). His reunion with his father, Big Daddy (Burl Ives), who is dying of cancer, jogs a host of memories and revelations for both father and son.",172,80,English,USA,3000000,6880917,0,0,6,3,10,84.0,0,1,0,0,0,0,0,0,0,0,0,0,0,0,0,0,0,0,0,0,0,0,0,0
737,tt8969332,The Biggest Little Farm,91.0,PG,8.1,2018,4238,Documentarian John Chester and his wife Molly work to develop a sustainable farm on 200 acres outside of Los Angeles.,73,67,English,USA,10000000,4366949,110492,0,0,15,27,73.0,0,0,0,0,0,0,0,0,0,0,0,0,0,0,0,0,0,0,0,0,0,1,0,0
738,tt0051808,The Hidden Fortress,126.0,Unrated,8.1,1958,32429,"Lured by gold, two greedy peasants escort a man and woman across enemy lines. However, they do not realize that their companions are actually a princess and her general.",114,97,Japanese,Japan,10000000,46808,15942,0,0,4,1,51.87179487179487,0,1,0,0,0,0,1,0,0,0,0,0,0,0,0,0,0,0,0,0,0,0,0,0
739,tt6316138,Ayla: The Daughter of War,125.0,Unrated,8.5,2017,31539,"In 1950, amid-st the ravages of the Korean War, Sergeant Süleyman stumbles upon a half-frozen little girl, with no parents and no help in sight. Frantic, scared and on the verge of death, ...                See full summary »",59,15,Chinese,Turkey,10000000,6880917,0,0,0,19,10,51.87179487179487,0,1,0,0,0,0,0,0,0,1,0,0,0,0,0,1,0,0,0,0,0,0,0,0
740,tt0061184,Who's Afraid of Virginia Woolf?,131.0,Unrated,8.0,1966,67033,"A bitter, aging couple, with the help of alcohol, use their young houseguests to fuel anguish and emotional pain towards each other over the course of a distressing night.",283,95,English,USA,7500000,28000000,0,5,0,17,26,75.0,0,1,0,0,0,0,0,0,0,0,0,0,0,0,0,0,0,0,0,0,0,0,0,0
741,tt4934950,Talvar,132.0,Unrated,8.2,2015,28944,An experienced investigator confronts several conflicting theories about the perpetrators of a violent double homicide.,84,38,Hindi,India,10000000,342370,144713,0,0,10,16,51.87179487179487,1,1,0,0,0,0,0,0,0,0,0,0,0,1,0,0,0,0,0,0,0,0,0,0
742,tt5895028,13th,100.0,TV-MA,8.2,2016,24295,An in-depth look at the prison system in the United States and how it reveals the nation's history of racial inequality.,82,95,English,USA,10000000,6880917,0,0,1,31,45,83.0,1,0,0,0,0,0,0,0,0,0,0,0,0,0,0,0,0,0,0,0,0,1,1,0
743,tt0046438,Tokyo Story,136.0,Unrated,8.2,1953,49031,"An old couple visit their children and grandchildren in the city, but receive little attention.",159,107,Japanese,Japan,10000000,6880917,0,0,0,3,0,51.87179487179487,0,1,0,0,0,0,0,0,0,0,0,0,0,0,0,0,0,0,0,0,0,0,0,0
744,tt1360860,Darbareye Elly,119.0,Unrated,8.0,2009,42661,The mysterious disappearance of a kindergarten teacher during a picnic in the north of Iran is followed by a series of misadventures for her fellow travelers.,78,149,Persian,"Iran, France",10000000,470760,13180,0,0,20,13,87.0,0,1,1,0,0,0,0,0,0,0,0,0,0,1,0,0,0,0,0,0,0,0,0,0
745,tt0043338,Ace in the Hole,111.0,Approved,8.1,1951,29815,"A frustrated former big-city journalist now stuck working for an Albuquerque newspaper exploits a story about a man trapped in a cave to rekindle his career, but the situation quickly escalates into an out-of-control circus.",181,114,English,USA,1800000,6880917,0,0,1,4,2,72.0,0,1,0,0,0,0,0,0,0,0,0,0,0,0,0,0,0,0,0,0,1,0,0,0
746,tt9900782,Kaithi,145.0,Unrated,8.5,2019,7401,A recently released prisoner becomes involved in a chase with criminals as he races against time to drive poisoned cops to hospital in exchange for meeting his daughter.,176,8,Tamil,India,240000000,6880917,0,0,0,2,0,51.87179487179487,0,0,1,0,0,1,0,0,0,0,0,0,0,0,0,0,0,0,0,0,0,0,0,0
747,tt8144834,Section 375,124.0,Unrated,8.1,2019,9173,"A celebrated Bollywood director Rohan Khurana stands accused by a female member of his crew, Anjali Dangle of having raped her at his residence.",170,24,Hindi,India,10000000,6880917,0,0,0,0,5,51.87179487179487,0,1,0,0,0,0,0,0,0,0,0,0,0,1,0,0,0,0,0,0,0,0,0,0
748,tt7838252,K.G.F: Chapter 1,156.0,Unrated,8.2,2018,30131,"In the 1970s, a fierce rebel rises against brutal oppression and becomes the symbol of hope to legions of downtrodden people.",1052,11,Kannada,India,10000000,6880917,0,0,0,10,0,51.87179487179487,0,1,0,0,0,1,0,0,0,0,0,0,0,0,0,0,0,0,0,0,0,0,0,0
749,tt0367110,Swades,189.0,Unrated,8.2,2004,79630,A successful Indian scientist returns to an Indian village to take his nanny to America with him and in the process rediscovers his roots.,270,78,Hindi,India,10000000,1223240,424804,0,0,13,23,51.87179487179487,0,1,0,0,0,0,0,0,0,0,0,0,0,0,0,0,0,0,0,0,0,0,0,0
750,tt0106375,Beethoven's 2nd,89.0,PG,4.9,1993,25055,"Beethoven, the St. Bernard dog, becomes a father, but his girlfriend Missy is dognapped, and his puppies are in danger of the same fate.",34,14,English,USA,15000000,53443066,6017225,0,1,0,4,51.87179487179487,0,0,0,1,0,0,0,0,0,0,0,0,1,0,1,0,0,0,0,0,0,0,0,0
751,tt5970844,Thugs of Hindostan,164.0,Unrated,4.0,2018,16801,"Recruited by the East India Company, a local thug infiltrates a troop of patriotic bandits who plan to overthrow the British regime and reclaim their independence.",920,29,Hindi,India,20000000,1449848,1185386,0,0,2,0,51.87179487179487,0,0,0,0,0,1,1,0,0,0,0,0,0,0,0,0,0,0,0,0,0,0,0,0
752,tt6210996,10x10,88.0,Unrated,5.0,2018,6603,"A man abducts a flower shop owner and holds her captive in a small, soundproof room in an effort to extract a dark secret from her past.",77,36,English,UK,10000000,2263,1430,0,0,0,0,51.87179487179487,0,0,1,0,0,0,0,0,0,0,0,0,0,0,0,0,0,0,0,0,0,0,0,0
753,tt3458254,Patient Zero,93.0,R,4.5,2018,7031,"After an unprecedented global pandemic turns the majority of humankind into violent ""Infected,"" a man gifted with the ability to speak the Infected's new language leads the last survivors on a hunt for Patient Zero and a cure.",195,33,English,UK,10000000,6880917,0,0,0,0,0,51.87179487179487,0,1,0,0,0,1,0,0,0,0,1,0,0,0,0,0,0,0,0,0,0,0,0,0
754,tt8976710,Sextuplets,97.0,TV-14,4.4,2019,6556,"Father-to-be Alan is shocked to learn that he was born a sextuplet. With his newfound brother Russell riding shotgun, the duo sets out on a hilarious journey to reunite with their remaining long-lost siblings.",179,19,English,USA,32000000,6880917,0,0,0,0,0,21.0,0,0,0,1,0,0,0,0,0,0,0,0,0,0,0,0,0,0,0,0,0,0,0,0
755,tt0242998,Valentine,96.0,R,4.8,2001,24423,Five women are stalked by an unknown assailant while preparing for Valentine's Day.,371,142,English,USA,29000000,20384136,10024648,0,0,2,0,18.0,0,0,1,0,0,0,0,0,0,0,1,0,0,1,0,0,0,0,0,0,0,0,0,0
756,tt6774786,Occupation,119.0,R,5.0,2018,11028,"A small group of town residents have to band together after a devastating ground invasion. As they struggle to survive, they realize they must stay one step ahead of their attackers, and work together for a chance to strike back.",414,33,English,Australia,10000000,6880917,0,0,0,1,0,45.0,0,1,0,0,0,1,0,1,0,0,0,0,0,0,0,0,0,0,0,0,0,0,0,0
757,tt0246894,Rollerball,98.0,PG-13,3.1,2002,25231,The big thing in 2005 is a violent sport which can have some pretty serious consequences... like dying.,295,156,English,"USA, Germany, Japan",70000000,18990798,9013548,0,0,5,3,14.0,0,0,0,0,0,1,0,1,0,0,0,0,0,0,0,0,0,0,1,0,0,0,0,0
758,tt6197494,Malicious,90.0,TV-MA,5.0,2018,2969,A young college professor and his pregnant wife unwittingly release a malevolent entity with murderous intentions.,55,10,English,USA,3500000,6880917,0,0,0,0,0,51.87179487179487,0,0,1,0,0,0,0,0,0,0,1,0,0,0,0,0,0,0,0,0,0,0,0,0
759,tt1137470,Accidental Love,100.0,PG-13,4.1,2015,7499,"A small town waitress gets a nail accidentally lodged in her head causing unpredictable behavior that leads her to Washington, D.C., where sparks fly when she meets a clueless young senator who takes up her cause - but what happens when love interferes with what you stand for?",35,60,English,"USA, UK",26000000,6880917,0,0,6,0,0,20.0,0,0,0,1,0,0,0,0,0,0,0,0,1,0,0,0,0,0,0,0,0,0,0,0
760,tt5669936,The Recall,90.0,R,4.2,2017,6486,"When five friends vacation at a remote lake house they expect nothing less than a good time, unaware that planet Earth is under an alien invasion and mass-abduction.",153,34,English,Canada,3600000,22943,6570,0,0,1,0,51.87179487179487,0,0,0,0,0,1,0,1,0,0,1,0,0,0,0,0,0,0,0,0,0,0,0,0
761,tt2124787,Final Girl,90.0,R,4.7,2015,13509,A man teaches a young woman how to become a complete weapon. Later she is approached by a group of sadistic teens who kill blonde women for unknown reasons. The hunting season begins.,150,69,English,"Canada, USA",8000000,6880917,0,0,0,1,1,51.87179487179487,0,0,1,0,0,0,0,0,0,0,1,0,0,0,0,0,0,0,0,0,0,0,0,0
762,tt0240462,Dr. Dolittle 2,87.0,PG,4.7,2001,40929,Dolittle must save a forest and a bear's life.,80,91,English,USA,70000000,112952899,25037039,0,0,3,6,49.0,0,0,0,1,0,0,0,0,0,0,0,1,0,0,1,0,0,0,0,0,0,0,0,0
763,tt5834854,Mary,84.0,R,4.4,2019,2138,A family looking to start a charter-boat business buys a ship that holds terrifying secrets once out on isolated waters.,61,45,English,USA,10000000,6880917,0,0,0,0,1,31.0,0,0,0,0,0,0,0,0,0,0,1,0,0,0,0,0,0,0,0,0,0,0,0,0
764,tt0083170,Tarzan the Ape Man,115.0,Approved,3.4,1981,5055,"While on an African expedition with her father, Jane Parker meets Tarzan, and the two become fascinated by each other.",70,28,English,USA,6500000,36565280,0,0,0,2,9,24.0,0,1,0,0,0,0,1,0,0,0,0,0,0,0,0,0,0,0,0,0,0,0,0,0
765,tt7959500,The Farm,80.0,Unrated,3.7,2018,1713,A young couple gets kidnapped and treated like farm animals after stopping at a roadside diner to eat meat.,94,13,English,USA,5000000,6880917,0,0,0,0,0,51.87179487179487,0,0,0,0,0,0,0,0,0,0,1,0,0,0,0,0,0,0,0,0,0,0,0,0
766,tt0068595,Flesh Gordon,78.0,R,4.7,1974,3789,"Emperor Wang is leader of the planet Porno and sends his mighty ""Sex Ray"" towards Earth, turning everyone into sex-mad fiends. Only one man can save the Earth, football player Flesh Gordon",50,70,English,USA,700000,6880917,0,0,0,0,1,51.87179487179487,0,0,0,1,0,0,0,1,0,0,0,0,0,0,0,0,0,0,0,0,0,0,0,0
767,tt0092115,Troll,82.0,PG-13,4.5,1986,8961,A wicked troll king in search of a mystical ring that will transform him to human form invades a San Francisco apartment complex where a powerful witch lives.,123,78,English,"USA, Italy",1100000,5450815,2595054,0,0,0,1,30.0,0,0,0,1,0,0,0,0,0,0,1,1,0,0,0,0,0,0,0,0,0,0,0,0
768,tt0052077,Plan 9 from Outer Space,79.0,Unrated,4.0,1959,35128,"Evil aliens attack Earth and set their terrible ""Plan 9"" into action. As the aliens resurrect the dead of the Earth, the lives of the living are in danger.",496,118,English,USA,60000,6880917,0,0,0,0,0,51.87179487179487,0,0,0,0,0,0,0,1,0,0,1,0,0,0,0,0,0,0,0,0,0,0,0,0
769,tt6003368,Diary of a Wimpy Kid: The Long Haul,91.0,PG,4.3,2017,6527,A Heffley family road trip to attend Meemaw's 90th birthday party goes hilariously off course thanks to Greg's newest scheme to get to a video gaming convention.,109,63,English,USA,22000000,20738724,7126084,0,0,0,1,39.0,0,0,0,1,0,0,0,0,0,0,0,0,0,0,1,0,0,0,0,0,0,0,0,0
770,tt3082898,Kickboxer: Vengeance,90.0,Unrated,4.9,2016,10065,A kick boxer is out to avenge his brother.,88,75,English,USA,10000000,6880917,0,0,0,0,0,37.0,1,1,0,0,0,1,0,0,0,0,0,0,0,0,0,0,0,0,0,0,0,0,0,0
771,tt0109770,The Fantastic Four,90.0,PG,3.8,1994,4815,"When dosed with cosmic rays, four intrepid explorers are given incredible powers.",138,58,English,"Germany, USA",1000000,6880917,0,0,0,0,0,51.87179487179487,0,0,0,0,0,1,1,0,0,0,0,0,0,0,1,0,0,0,0,0,0,0,0,0
772,tt2103254,Tammy,97.0,R,4.9,2014,46446,"After losing her job and learning that her husband has been unfaithful, a woman hits the road with her profane, hard-drinking grandmother.",171,147,English,USA,20000000,84525432,21577049,0,0,1,7,39.0,0,0,0,1,0,0,0,0,0,0,0,0,1,0,0,0,0,0,0,0,0,0,0,0
773,tt0116756,Kazaam,93.0,PG,3.0,1996,22636,"A troubled kid inadvertently releases a genie, who must grant him any three wishes he requests.",105,21,English,USA,20000000,18937262,5001588,0,0,0,2,24.0,0,0,0,1,0,0,0,0,0,0,0,1,0,0,1,0,0,0,0,0,0,0,0,0
774,tt0108308,Teenage Mutant Ninja Turtles III,96.0,PG,4.8,1993,30061,The turtles find themselves transported back in time to ancient Japan.,95,67,English,"USA, Hong Kong",21000000,42273609,12419597,0,0,1,0,40.0,0,0,0,1,0,1,1,0,0,0,0,0,0,0,0,0,0,0,0,0,0,0,0,0
775,tt6563576,The Queen's Corgi,85.0,PG,4.8,2019,4621,The British monarch's (Dame Julie Walters') favorite dog gets lost from the palace and finds himself at a dog fight club. He then begins his long journey to find his way back home.,129,31,English,"Belgium, USA",10000000,6880917,0,0,0,0,0,51.87179487179487,0,0,0,1,0,0,0,0,0,0,0,0,0,0,1,0,0,1,0,0,0,0,0,0
776,tt0211181,102 Dalmatians,100.0,G,4.9,2000,33764,Cruella DeVil gets out of prison and goes after the puppies once more.,84,88,English,"USA, UK",85000000,66957026,19883351,0,1,1,7,35.0,0,0,0,1,0,0,1,0,0,0,0,0,0,0,1,0,0,0,0,0,0,0,0,0
777,tt0282209,Darkness Falls,86.0,PG-13,5.0,2003,29659,"A vengeful spirit has taken the form of the Tooth Fairy to exact vengeance on the town that lynched her 150 years earlier. Her only opposition is the only child, now grown up, who has survived her before.",370,146,English,"USA, Australia",11000000,32551396,12024917,0,0,1,2,23.0,0,0,0,0,0,0,0,0,0,0,1,1,0,1,0,0,0,0,0,0,0,0,0,0
778,tt4992060,Compulsion,84.0,Unrated,3.7,2016,1171,"After a fight with her boyfriend, a successful female erotic novelist on a book tour of Europe joins her ex and his female friend, with whom she falls madly in love, for a party at a castle owned by a dangerous cult.",15,4,English,"UK, Canada, Italy",2000000,6880917,0,0,0,0,0,51.87179487179487,0,1,0,0,0,0,0,0,0,0,1,1,0,0,0,0,0,0,0,0,0,0,0,0
779,tt7942736,Spider in the Web,113.0,Unrated,4.3,2019,1104,"A young operative is sent on a mission to follow an older agent, whose behavior has come into question.",30,14,English,"Israel, Belgium, UK",10000000,6880917,0,0,0,0,0,51.87179487179487,0,0,1,0,0,0,0,0,0,0,0,0,0,0,0,0,0,0,0,0,0,0,0,0
780,tt0265087,Black Knight,95.0,PG-13,4.9,2001,37166,"Martin Lawrence plays Jamal, an employee in Medieval World amusement park. After sustaining a blow to the head, he awakens to find himself in 14th century England.",172,49,English,USA,50000000,33426971,11102948,0,0,0,2,32.0,0,0,0,1,0,0,1,0,0,0,0,1,0,0,0,0,0,0,0,0,0,0,0,0
781,tt5612742,F*&% the Prom,92.0,Unrated,4.2,2017,4300,1st day of high school 2 friends split and 3.5 years later he's still the least popular and she's the most popular girl but brutally loses the throne and allies with her old friend and get Machiavellian at the popular girls and their prom.,65,2,English,USA,10000000,6880917,0,0,0,0,0,51.87179487179487,0,1,0,1,0,0,0,0,0,0,0,0,0,0,0,0,0,0,0,0,0,0,0,0
782,tt6014472,S.W.A.T.: Under Siege,89.0,R,4.6,2017,2291,A SWAT compound comes under fire from an international terrorist who relentlessly and violently pursues a mystery man who was apprehended by Seattle SWAT after a raid went horribly wrong.,27,17,English,USA,10000000,6880917,0,0,0,0,0,51.87179487179487,0,0,1,0,0,1,0,0,0,0,0,0,0,0,0,0,0,0,0,0,0,0,0,0
783,tt6988116,Kalank,166.0,Unrated,3.6,2019,10497,"The lives of six enigmatic characters become entangled whilst in search of love, but separated by the dichotomy between the two worlds of Husnabad, a town in North India.",496,23,Hindi,India,1500000000,2729336,1276581,0,0,12,11,51.87179487179487,0,1,0,0,0,0,0,0,0,0,0,0,1,0,0,0,0,0,0,0,0,0,0,0
784,tt0096149,Space Mutiny,91.0,Unrated,2.1,1988,6454,"A pilot is the only hope to stop the mutiny of a spacecraft by its security crew, who plot to sell the crew of the ship into slavery.",184,37,English,"South Africa, USA",10000000,397887,0,0,0,0,0,51.87179487179487,0,0,0,0,0,1,1,0,0,0,0,0,1,0,0,0,0,0,0,0,0,0,0,0
785,tt9614460,Chhapaak,120.0,Unrated,5.0,2020,23633,"The trials and triumphs of Malti, an acid attack survivor. From the investigation of the attack to the court proceedings, the medical treatment to the emotional healing. Chhapaak is the story of the unquashable human spirit.",1281,20,Hindi,India,10000000,604334,316781,0,0,0,0,51.87179487179487,0,1,0,0,0,0,0,0,0,1,0,0,0,0,0,0,0,0,0,0,0,0,0,0
786,tt0095889,Poltergeist III,98.0,PG-13,4.7,1988,16323,"Carol Anne is staying with her aunt in a high-rise building, where the supernatural forces haunting her make their return.",127,79,English,USA,10500000,14114488,4344308,0,0,0,2,40.0,0,0,1,0,0,0,0,0,0,0,1,0,0,0,0,0,0,0,0,0,0,0,0,0
787,tt0114151,Poison Ivy II,106.0,R,4.4,1996,5361,"First time out of Michigan, Lily starts art school in LA and shares a house with other young artistic people. Both her teacher and a roomie/classmate show interest in her.",37,12,English,USA,10000000,6880917,0,0,0,0,0,51.87179487179487,0,1,1,0,0,0,0,0,0,0,0,0,0,0,0,0,0,0,0,0,0,0,0,0
788,tt0419946,The Marine,92.0,PG-13,4.7,2006,31811,A group of diamond thieves on the run kidnap the wife of a recently discharged marine who goes on a chase through the South Carolinian wilderness to retrieve her.,304,85,English,USA,20000000,18844784,7138774,0,0,0,0,45.0,0,1,0,1,0,1,0,0,0,0,0,0,0,0,0,0,0,0,0,0,0,0,0,0
