,movie_id,title,runtime,certificate,imdb_rating,year,votes,summary,user_review,critic_review,language,country,budget,gross,opening_week,oscar_win,oscar_nom,other_win,other_nom,meta_score,Crime,Drama,Thriller,Comedy,War,Action,Adventure,Sci-Fi,Western,Biography,Horror,Fantasy,Romance,Mystery,Family,History,Music,Animation,Sport,Musical,Film-Noir,Documentary,News,Short
2123,tt1687221,Eu Não Quero Voltar Sozinho,17.0,Unrated,8.3,2010,6759,"The arrival of a new student in school changes Leonardo's life. This 15 year-old blind teenager has to deal with the jealousy of his friend Giovana while figuring out the new feelings he's having towards his new friend, Gabriel.",7,7,Portuguese,Brazil,80000,6880917,0,0,0,22,2,51.87179487179487,0,1,0,0,0,0,0,0,0,0,0,0,1,0,0,0,0,0,0,0,0,0,0,1
2124,tt0165473,Demons,134.0,Unrated,8.0,1971,1683,"After being robbed by a geisha, a ronin warrior carves a bloody path to seek revenge.",7,10,Japanese,Japan,10000000,6880917,0,0,0,0,0,51.87179487179487,0,1,0,0,0,0,0,0,0,0,1,0,0,0,0,0,0,0,0,0,0,0,0,0
2125,tt0765833,Neseli Günler,92.0,Unrated,8.8,1978,9352,A mid-aged couple with 6 kids who are running a pickle shop gets divorced with 3 kids each. The family members find each other years later with a funny story.,2,1,Turkish,Turkey,10000000,6880917,0,0,0,0,0,51.87179487179487,0,1,0,1,0,0,0,0,0,0,0,0,0,0,1,0,0,0,0,0,0,0,0,0
2126,tt7689958,Jane Fonda in Five Acts,133.0,TV-14,8.0,2018,1702,"A look at the life, work, activism and controversies of actress and fitness tycoon, Jane Fonda.",22,16,English,USA,10000000,6880917,0,0,0,1,3,87.0,0,0,0,0,0,0,0,0,0,0,0,0,0,0,0,0,0,0,0,0,0,1,0,0
2127,tt1698010,TT3D: Closer to the Edge,104.0,Unrated,8.0,2011,6064,"By vividly recounting the TT's legendary rivalries and the Isle of Man's unique road racing history, this 3D feature documentary will discover why modern TT riders still risk their lives to...                See full summary »",44,33,English,UK,10000000,6880917,0,0,0,0,2,76.0,0,0,0,0,0,0,0,0,0,0,0,0,0,0,0,0,0,0,1,0,0,1,0,0
2128,tt0065067,A tanú,105.0,Unrated,8.8,1969,5935,"Banned for over a decade for its outspoken criticism of the post-WWII communist regime in Hungary, Péter Bacsó's 'The Witness' has since then achieved unparalleled cult status in its native...                See full summary »",9,4,Hungarian,Hungary,10000000,6880917,0,0,0,0,0,51.87179487179487,0,1,0,1,0,0,0,0,0,0,0,0,0,0,0,0,0,0,0,0,0,0,0,0
2129,tt0252488,Hababam Sinifi Sinifta Kaldi,91.0,Unrated,9.0,1976,20961,A young and beautiful female teacher starts working in an all boys high school.,4,1,Turkish,Turkey,10000000,6880917,0,0,0,1,0,51.87179487179487,0,0,0,1,0,0,0,0,0,0,0,0,0,0,0,0,0,0,0,0,0,0,0,0
2130,tt2486682,Al midan,95.0,Unrated,8.1,2013,8385,"A group of Egyptian revolutionaries battle leaders and regimes, risking their lives to build a new society of conscience.",46,72,Arabic,"UK, Egypt, USA",1500000,124244,16359,0,1,16,14,84.0,0,0,0,0,0,0,0,0,0,0,0,0,0,0,0,0,0,0,0,0,0,1,1,0
2131,tt3317874,Charlie's Farm,93.0,Unrated,4.6,2014,3042,"In an effort to do something different, four friends head into Australia's outback to explore Charlie's Farm, the site where a violent family met their end at the hands of an angry mob. ...                See full summary »",80,40,English,Australia,1300000,6880917,0,0,0,0,0,51.87179487179487,0,0,0,1,0,0,0,0,0,0,1,0,0,0,0,0,0,0,0,0,0,0,0,0
2132,tt1132449,Lay the Favorite,94.0,R,4.8,2012,10952,"Ex-private dancer Beth aspires to be a Las Vegas cocktail waitress, when she falls in with Dink, a sports gambler. Sparks fly as she proves to be something of a gambling prodigy--much to the ire of Dink's wife, Tulip.",44,117,English,"USA, UK, France",26350000,20998,20998,0,0,0,1,38.0,0,1,0,1,0,0,0,0,0,0,0,0,1,0,0,0,0,0,0,0,0,0,0,0
2133,tt5882970,Tubelight,136.0,Unrated,4.0,2017,13451,"A story of two brothers set during the Sino-Indian war, 1962: the younger one who's at war at the borders and the elder who's at war with his own world.",125,28,Hindi,India,1550000000,930058,930058,0,0,1,3,51.87179487179487,0,1,0,0,1,0,0,0,0,0,0,0,0,0,0,0,0,0,0,0,0,0,0,0
2134,tt5181852,Slumber,84.0,R,4.7,2017,3495,A sleep doctor tries to protect a family from a demon that feeds on people in their nightmares.,49,28,English,"UK, USA",10000000,6880917,0,0,0,0,1,51.87179487179487,0,0,0,0,0,0,0,0,0,0,1,0,0,0,0,0,0,0,0,0,0,0,0,0
2135,tt3496372,The Intruders,92.0,PG-13,4.6,2015,2569,"After the traumatic loss of her mother, a teenaged girl tries to uncover the dark secrets behind her new home, in spite of her father's disbelief.",19,15,English,Canada,10000000,6880917,0,0,0,0,0,51.87179487179487,0,1,0,0,0,0,0,0,0,0,1,0,0,1,0,0,0,0,0,0,0,0,0,0
2136,tt4076760,Diablo,90.0,R,4.5,2015,4549,A young civil war veteran is forced on a desperate journey to save his kidnapped wife.,78,27,English,"Canada, USA",10000000,6880917,0,0,0,2,3,35.0,0,0,1,0,0,1,1,0,0,0,0,0,0,0,0,0,0,0,0,0,0,0,0,0
2137,tt0290212,Full Frontal,101.0,R,4.7,2002,9371,"A day in the life of a group of men and women in Hollywood, in the hours leading up to a friend's birthday party.",169,108,English,USA,2000000,2512846,739834,0,0,0,1,45.0,0,0,0,1,0,0,0,0,0,0,0,0,1,0,0,0,0,0,0,0,0,0,0,0
2138,tt4009460,Saving Christmas,79.0,PG,1.4,2014,14729,"His annual Christmas party faltering thanks to his cynical brother-in-law, former Growing Pains star Kirk Cameron attempts to save the day by showing him that Jesus Christ remains a crucial component of the over-commercialized holiday..",167,27,English,USA,500000,2783970,992087,0,0,4,2,18.0,0,0,0,1,0,0,0,0,0,0,0,0,0,0,1,0,0,0,0,0,0,0,0,0
2139,tt4458206,Code Name: K.O.Z.,114.0,Unrated,1.3,2015,27021,"A look at the 17-25 December 2013 corruption scandal in Turkey, from the viewpoint of the Erdogan government.",73,3,Turkish,Turkey,10000000,6880917,0,0,0,0,0,51.87179487179487,1,0,0,0,0,0,0,0,0,0,0,0,0,1,0,0,0,0,0,0,0,0,0,0
2140,tt0089598,Miranda,96.0,Unrated,5.0,1985,1863,"In this erotic comedy, Miranda is the landlady of a small country tavern who is looking for a husband, and tries out a variety of men for size.",4,6,Italian,Italy,10000000,6880917,0,0,0,0,4,51.87179487179487,0,0,0,1,0,0,0,0,0,0,0,0,1,0,0,0,0,0,0,0,0,0,0,0
2141,tt0094744,Big Top Pee-wee,86.0,PG,5.0,1988,8500,"Pee-wee Herman is now a small-town farmer with a fiancée, but when a traveling circus comes to town, he finds himself falling for the trapeze artist.",55,17,English,USA,10000000,15122324,4625004,0,0,0,1,42.0,0,0,0,1,0,0,1,0,0,0,0,0,1,0,0,0,0,0,0,0,0,0,0,0
2142,tt1816608,Another Me,86.0,PG-13,4.7,2013,5255,A teenager finds her perfect life upended when she's stalked by a mysterious doppelganger who has her eyes set on assuming her identity.,17,36,English,"UK, Spain",10000000,6880917,0,0,0,0,2,51.87179487179487,0,0,1,0,0,0,0,0,0,0,0,0,0,1,0,0,0,0,0,0,0,0,0,0
2143,tt3533916,The Veil,93.0,R,4.7,2016,7188,"Twenty-five years after members of a religious cult committed mass suicide, the lone survivor returns to the scene of the tragedy with a documentary crew in tow.",52,43,English,USA,4000000,6880917,0,0,0,0,0,51.87179487179487,0,0,0,0,0,0,0,0,0,0,1,0,0,0,0,0,0,0,0,0,0,0,0,0
2144,tt0078238,Sextette,91.0,PG,3.5,1977,1156,"On the day of her wedding to her sixth husband, a glamorous silver screen sex symbol is asked to intervene in a political dispute between nations, which leads to chaos.",64,37,English,USA,10000000,6880917,0,0,0,0,2,51.87179487179487,0,0,0,1,0,0,0,0,0,0,0,0,1,0,0,0,0,0,0,1,0,0,0,0
2145,tt6409762,Big Legend,89.0,Unrated,4.9,2018,2190,An ex-soldier ventures into the Pacific Northwest to uncover the truth behind his fiance's disappearance.,83,14,English,USA,10000000,6880917,0,0,0,1,0,51.87179487179487,0,0,0,0,0,1,1,0,0,0,1,0,0,0,0,0,0,0,0,0,0,0,0,0
2146,tt0086013,Nightbeast,80.0,R,4.0,1982,1324,A creature from outer space crash lands in a small town and starts killing people.,30,37,English,USA,42000,6880917,0,0,0,0,0,51.87179487179487,0,0,0,0,0,0,0,1,0,0,1,0,0,0,0,0,0,0,0,0,0,0,0,0
2147,tt0119640,McHale's Navy,108.0,PG,4.6,1997,6303,The former World War II Naval captain of PT-73 - now a fun-loving black marketeer - reunites with his crew to battle a bumbling Russian terrorist. Based on the hit 1960s television show.,43,21,English,USA,31190000,4529843,2128565,0,0,2,2,18.0,0,0,0,1,0,1,0,0,0,0,0,0,0,0,0,0,0,0,0,0,0,0,0,0
2148,tt0106684,Deadfall,98.0,R,4.0,1993,2811,"When Joe loses his dad in a sting, he contacts his dad's twin, Lou, who has a major sting planned. Lou's helper feels threatened by Joe. Who's conning who?",32,20,English,USA,10000000,18369,9183,0,0,0,0,51.87179487179487,1,1,0,0,0,0,0,0,0,0,0,0,0,0,0,0,0,0,0,0,0,0,0,0
2149,tt1562899,Jinn,97.0,PG-13,4.2,2014,4475,"Shawn, an automotive designer, enjoys an idyllic life with his new wife Jasmine until it is interrupted by a cryptic message. The message warns of imminent danger and a curse that has ...                See full summary »",54,22,English,USA,10000000,202348,149337,0,0,0,0,24.0,0,0,1,0,0,0,0,0,0,0,1,1,0,0,0,0,0,0,0,0,0,0,0,0
2150,tt2872724,Out of the Dark,92.0,R,4.8,2014,3933,"A couple and their daughter move to Colombia to take over a family manufacturing plant, only to realize their new home is haunted.",26,44,English,"USA, United Arab Emirates, Colombia, Spain",10000000,6880917,0,0,0,0,0,33.0,0,0,1,0,0,0,0,0,0,0,1,0,0,0,0,0,0,0,0,0,0,0,0,0
2151,tt0463027,Descent,104.0,R,4.8,2007,2882,A college co-ed is brutally raped and struggles alone to rebuild her life.,40,31,English,USA,10000000,15233,8411,0,0,0,0,45.0,0,1,1,0,0,0,0,0,0,0,0,0,0,0,0,0,0,0,0,0,0,0,0,0
2152,tt3797142,Bachelor Night,88.0,Unrated,3.4,2014,1466,"When a bachelor party and a bachelorette party cross paths in Vegas, only the best man and the maid of honor can save their friends from a night of epic ""mistakes.""",6,0,English,USA,10000000,6880917,0,0,0,0,0,51.87179487179487,0,0,0,1,0,0,0,0,0,0,0,0,0,0,0,0,0,0,0,0,0,0,0,0
2153,tt2962726,The Anomaly,97.0,Unrated,4.7,2014,7068,"An ex-soldier named Ryan Reeve is taken captive by the ""Anomaly"" organization where he learns that he only has 9:47 minutes/seconds to find out why they want him dead.",42,35,English,UK,10000000,6880917,0,0,0,0,1,27.0,0,0,0,0,0,1,0,1,0,0,0,0,0,1,0,0,0,0,0,0,0,0,0,0
2154,tt0099701,The Rift,83.0,R,4.7,1990,1579,"An experimental submarine, the ""Siren II"", is sent to find out what happened to the ""Siren I"", which has mysteriously disappeared in a submarine rift. Things go awry when they begin to find...                See full summary »",23,33,English,"Spain, USA",1300000,6880917,0,0,0,1,1,51.87179487179487,0,0,0,0,0,1,1,0,0,0,1,0,0,0,0,0,0,0,0,0,0,0,0,0
2155,tt7052244,Robin Hood: The Rebellion,92.0,Unrated,4.3,2018,2025,"With his true love captured by the villainous Sheriff of Nottingham, the legendary Robin Hood and his crew of outlaws execute a daring rescue to save her.",71,5,English,UK,10000000,6880917,0,0,0,0,0,51.87179487179487,0,0,0,0,0,1,1,0,0,0,0,0,0,0,0,1,0,0,0,0,0,0,0,0
2156,tt1877543,247°F,88.0,R,4.9,2011,5430,"Four friends travel to a lakeside cabin for a carefree weekend, the fun turns into a nightmare when 3 of them end up locked in a hot sauna. Every minute counts and every degree matters as they fight for their lives in the heat up to 247°F.",36,31,English,"USA, Georgia",650000,6880917,0,0,0,0,0,51.87179487179487,0,0,1,0,0,0,0,0,0,0,1,0,0,0,0,0,0,0,0,0,0,0,0,0
2157,tt0150176,Coming Soon,96.0,R,4.5,1999,1527,"The trials and tribulations of wealthy young Manhattanites and their sexual coming of age, a romantic comedy set at an Upper East Side prep school.",28,8,English,USA,10000000,5453,3742,0,0,0,0,44.0,0,0,0,1,0,0,0,0,0,0,0,0,1,0,0,0,0,0,0,0,0,0,0,0
2158,tt0811106,The Ten,96.0,R,5.0,2007,16182,"Ten stories, each inspired by one of the ten commandments.",117,65,English,"USA, Mexico",5250000,769726,121374,0,0,0,1,50.0,0,0,0,1,0,0,0,0,0,0,0,0,1,0,0,0,0,0,0,0,0,0,0,0
2159,tt4114762,Ask Sana Benzer,115.0,Unrated,3.8,2015,2872,"A young girl, with a troubled past, and a young boy fall in love in a small but beautiful town.",6,0,Turkish,Turkey,10000000,6880917,0,0,0,0,0,51.87179487179487,0,1,0,0,0,0,0,0,0,0,0,0,0,0,0,0,0,0,0,0,0,0,0,0
2160,tt0099656,Ghosts Can't Do It,90.0,R,2.2,1989,2337,"Elderly Scott kills himself after a heart attack wrecks his body, but then comes back as a ghost and convinces his loving young hot wife Kate to pick and kill a young man in order for Scott to possess his body and be with her again.",20,11,English,USA,10000000,25000,0,0,0,4,6,51.87179487179487,1,0,0,1,0,0,0,0,0,0,0,1,0,0,0,0,0,0,0,0,0,0,0,0
2161,tt2345613,Leprechaun: Origins,90.0,R,3.2,2014,4867,Not related to the previous Leprechain films. Two young couples backpacking through Ireland discover that one of Ireland's most famous legends is a terrifying reality.,96,62,English,USA,10000000,6880917,0,0,0,0,2,51.87179487179487,0,0,0,0,0,0,0,0,0,0,1,1,0,0,0,0,0,0,0,0,0,0,0,0
2162,tt0120742,Major League: Back to the Minors,100.0,PG-13,4.6,1998,6952,"Gus Cantrell turns his team from a laughingstock into the equivalent of blue-chip stocks in this third Major League comedy that reunites five series returnies, including wisecracking play-by-play man, Bob Uecker.",46,28,English,USA,18000000,3572443,2087011,0,0,1,0,51.87179487179487,0,0,0,1,0,0,0,0,0,0,0,0,0,0,0,0,0,0,1,0,0,0,0,0
2163,tt1714209,In the Land of Blood and Honey,127.0,R,4.5,2011,33150,"During the Bosnian War, Danijel, a soldier fighting for the Serbs, re-encounters Ajla, a Bosnian who's now a captive in his camp he oversees. Their once promising connection has become ambiguous as their motives have changed.",154,112,Bosnian,USA,13000000,303877,18854,0,0,5,6,56.0,0,1,0,0,1,0,0,0,0,0,0,0,1,0,0,0,0,0,0,0,0,0,0,0
2164,tt3598222,Mercenaries,89.0,Unrated,3.7,2014,2222,"The President's daughter is captured and imprisoned while touring a war zone, so a team of elite female commandos is assembled to infiltrate a women's prison for a daring rescue.",35,41,English,USA,10000000,6880917,0,0,0,1,0,51.87179487179487,0,0,0,0,0,1,1,0,0,0,0,0,0,0,0,0,0,0,0,0,0,0,0,0
2165,tt3465074,88,88.0,Unrated,5.0,2015,3157,"A young woman comes to in a roadside diner with no idea where she is or how she got there. Split between two timelines, she gets taken on a violent journey as she seeks out the person responsible for her lover's death.",21,30,English,Canada,10000000,6880917,0,0,0,0,0,51.87179487179487,0,0,1,0,0,1,0,0,0,0,0,0,0,0,0,0,0,0,0,0,0,0,0,0
2166,tt0780595,Redline,95.0,PG-13,4.0,2007,8487,A gorgeous young automobile fanatic--and front to the hottest unsigned band on the West coast--finds herself caught up in illegal drag-racing competitions organized by exotic car fanatics.,103,32,English,USA,26000000,6881022,3962385,0,0,0,1,24.0,0,0,0,0,0,1,0,0,0,0,0,0,0,0,0,0,0,0,0,0,0,0,0,0
2167,tt0106557,Children of the Corn II: The Final Sacrifice,92.0,R,4.3,1992,7419,"A journalist and his son travel to Nebraska to investigate the mysterious town of Gatlin where, unbeknownst to them, a murderous cult of children are still waiting in the corn fields.",85,62,English,USA,900000,6980986,2719750,0,0,0,1,18.0,0,0,1,0,0,0,0,0,0,0,1,0,0,0,0,0,0,0,0,0,0,0,0,0
2168,tt0081695,Up the Academy,87.0,R,4.9,1980,1502,"Four boys are sent, for different reasons, to a Military Academy. The life of discipline asks a lot of the four geeks. Of course these boys know how to make a party out of the hard times. Will they be ""real men"" after one year.",25,15,English,USA,10000000,6880917,0,0,0,0,3,29.0,0,0,0,1,0,0,0,0,0,0,0,0,0,0,0,0,0,0,0,0,0,0,0,0
2169,tt4433646,Terra Formars,108.0,Unrated,4.7,2016,1720,"In an attempt to colonize Mars, 21st century scientists seed the planet with algae to absorb sun light and purify the atmosphere, and cockroaches who in turn spread the algae as they feed. ...                See full summary »",11,39,Japanese,Japan,10000000,6880917,0,0,0,0,0,51.87179487179487,0,0,0,0,0,1,0,1,0,0,1,0,0,0,0,0,0,0,0,0,0,0,0,0
2170,tt0087700,Meatballs Part II,87.0,PG,3.8,1984,2199,Second in the series of Meatball movies. A group of kids attempt to save a summer camp that's a financial failure.,21,8,English,USA,10000000,5410972,2515268,0,0,0,0,21.0,0,0,0,1,0,0,0,0,0,0,0,0,0,0,0,0,0,0,0,0,0,0,0,0
2171,tt2674430,Approaching the Unknown,90.0,R,4.8,2016,8051,A U.S. astronaut prepares for a mission to Mars.,107,25,English,USA,10000000,10232,6476,0,0,1,0,53.0,0,1,1,0,0,0,0,1,0,0,0,0,0,0,0,0,0,0,0,0,0,0,0,0
2172,tt1653690,Ong-bak 3,99.0,R,5.0,2010,12739,Ong Bak 3 picks up where Ong Bak 2 had left off. Tien is captured and almost beaten to death before he is saved and brought back to the Kana Khone villagers. There he is taught meditation ...                See full summary »,48,73,Thai,Thailand,10000000,14890,5648,0,0,0,3,38.0,0,0,0,0,0,1,0,0,0,0,0,0,0,0,0,0,0,0,0,0,0,0,0,0
2173,tt0120836,Lost & Found,100.0,PG-13,5.0,1999,6147,"In order to impress his beautiful French neighbor, Dylan Ramsey dognaps her pet pooch so he can return him and become a hero. Unfortunately, things do not work out as planned.",62,33,English,USA,30000000,6552255,3024709,0,0,0,1,19.0,0,0,0,1,0,0,0,0,0,0,0,0,1,0,0,0,0,0,0,0,0,0,0,0
2174,tt6143782,Hex,85.0,Unrated,4.7,2018,2478,A couple's holiday romance is thrown into chaos as they are afflicted by a malicious force.,50,8,English,"USA, Canada",10000000,6880917,0,0,0,0,0,51.87179487179487,0,0,1,0,0,0,0,0,0,0,1,0,0,0,0,0,0,0,0,0,0,0,0,0
2175,tt0893509,Blonde and Blonder,95.0,PG-13,2.8,2008,3446,"Comic mayhem ensues when two lovely blondes, Dee and Dawn, are mistaken as international mob killers.",20,12,English,Canada,8000000,42183,26470,0,0,0,0,51.87179487179487,1,0,0,1,0,0,0,0,0,0,0,0,0,0,0,0,0,0,0,0,0,0,0,0
2176,tt5804314,Let There Be Light,100.0,PG-13,4.7,2017,2373,An atheist goes through a near-death experience in a car accident before converting to Christianity.,106,18,English,USA,3000000,7233471,1729535,0,0,0,1,51.87179487179487,0,1,0,0,0,0,0,0,0,0,0,0,0,0,0,0,0,0,0,0,0,0,0,0
2177,tt0099399,Delta Force 2: The Colombian Connection,111.0,R,4.9,1990,6513,"When DEA agents are taken captive by a ruthless South American kingpin, the Delta Force is reunited to rescue them in this sequel to the 1986 film.",56,39,English,USA,10000000,6698361,1854379,0,0,0,0,51.87179487179487,1,0,0,0,0,1,1,0,0,0,0,0,0,0,0,0,0,0,0,0,0,0,0,0
2178,tt0089271,The Adventures of Hercules,88.0,PG,4.0,1985,1129,"Hercules searches for the Seven Thunderbolts of Zeus, which have been stolen by renegade gods.",23,38,English,"Italy, USA, Netherlands",10000000,6880917,0,0,0,0,0,51.87179487179487,0,0,0,0,0,0,1,0,0,0,0,1,0,0,0,0,0,0,0,0,0,0,0,0
2179,tt0813996,Different,123.0,Unrated,3.8,2006,1111,An odd orphan boy is forced to use his secret super powers when his new classmates bully him. A scientist abducts him to use the boy's powers for his own evil gains.,12,3,Hindi,India,28000000,6880917,0,0,0,0,0,51.87179487179487,0,1,0,0,0,1,0,0,0,0,0,1,0,0,0,0,0,0,0,0,0,0,0,0
2180,tt0291855,Devasuram,187.0,Unrated,8.7,1993,4408,The heir to a village elder's family squanders his inheritance and bullies all and sundry.,9,1,Malayalam,India,10000000,6880917,0,0,0,1,0,51.87179487179487,0,1,1,0,0,1,0,0,0,0,0,0,0,0,0,0,0,0,0,0,0,0,0,0
2181,tt8354112,Mosul,86.0,Unrated,8.6,2019,1802,"The gritty, thrilling story of local militias and uneasy allies who banded together to liberate Iraq's second-largest city of 1.3 million people from ISIS in 2017.",11,3,English,USA,600000,6880917,0,0,0,0,2,51.87179487179487,0,0,0,0,0,0,0,0,0,0,0,0,0,0,0,0,0,0,0,0,0,1,0,0
2182,tt0083275,Variola vera,110.0,Unrated,8.2,1982,2214,This is a true story of the famous Variola epidemic outbreak in Belgrade.,12,8,Serbo-Croatian,Yugoslavia,10000000,6880917,0,0,0,0,0,51.87179487179487,0,1,0,0,0,0,0,0,0,0,1,0,0,0,0,1,0,0,0,0,0,0,0,0
2183,tt1524539,Harishchandrachi Factory,96.0,Unrated,8.4,2009,1958,"In 1913 India's cinema industry is born from Dadasaheb Phalke's efforts to make Raja Harishchandra (1913), India's first feature-length B&W silent film.",20,9,Marathi,India,10000000,6880917,0,0,0,1,0,51.87179487179487,0,1,0,1,0,0,0,0,0,1,0,0,0,0,0,0,0,0,0,0,0,0,0,0
2184,tt0213969,Padayappa,181.0,Unrated,8.1,1999,5178,"The death of Padaiyappa's father destroys his family. But his luck changes, and he is able to lead a prosperous life, until his nemesis plots to ruin his happiness once more.",8,1,Tamil,India,10000000,6880917,0,0,0,5,0,51.87179487179487,0,1,0,1,0,1,0,0,0,0,0,0,0,0,0,0,0,0,0,0,0,0,0,0
2185,tt10422658,25 Litre,109.16890459363958,Unrated,9.2,2019,1787,"This semi scripted documentary hosted by Gokhan Ozoguz revolves around the issue of water crisis. In a near future, Istanbul will be on the verge of a water crisis, and if the people of ...                See full summary »",7,0,Turkish,Turkey,10000000,6880917,0,0,0,0,0,51.87179487179487,0,0,0,0,0,0,0,0,0,0,0,0,0,0,0,0,0,0,0,0,0,1,0,0
2186,tt0082162,Chashme Buddoor,145.0,Unrated,8.0,1981,2136,"Two womanizing slackers, Omi and Jai (Rakesh Bedi and Ravi Baswani respectively) attempt to woo the new girl in the neighbourhood, and fail - miserably. Their third room-mate, shy, and a ...                See full summary »",18,6,Hindi,India,10000000,6880917,0,0,0,0,5,51.87179487179487,0,0,0,1,0,0,0,0,0,0,0,0,1,0,1,0,0,0,0,0,0,0,0,0
2187,tt9095324,Coldplay: A Head Full of Dreams,115.0,Unrated,8.0,2018,2442,A HEAD FULL OF DREAMS offers an in-depth and intimate portrait of the band's spectacular rise from the backrooms of Camden pubs to selling out stadiums across the planet. At the heart of ...                See full summary »,31,6,English,UK,2300000,6880917,0,0,0,0,0,64.0,0,0,0,0,0,0,0,0,0,0,0,0,0,0,0,0,1,0,0,0,0,1,0,0
2188,tt0122565,Istoria mias kalpikis liras,127.0,Unrated,8.6,1955,2379,"Pivoting around a shiny counterfeit gold sovereign freshly milled from the clandestine workshop of an otherwise honest goldsmith, four brief vignettes of human imperfection; seduction; fate; desire, and devotion inextricably interweave.",8,3,Greek,Greece,10000000,6880917,0,0,0,0,0,51.87179487179487,0,1,0,1,0,0,0,0,0,0,0,0,1,0,0,0,0,0,0,0,0,0,0,0
2189,tt0065417,Aranyer Din Ratri,115.0,Unrated,8.2,1970,2194,"A group of Calcutta city slickers, including the well-off Asim (Soumitra Chatterjee), the meek Sanjoy (Subhendu Chatterjee) and the brutish Hari (Samit Bhanja), head out for a weekend in the wilderness.",9,24,Bengali,India,10000000,6880917,0,0,0,0,2,51.87179487179487,0,1,0,0,0,0,0,0,0,0,0,0,0,0,0,0,0,0,0,0,0,0,0,0
2190,tt8076222,Untamed Romania,92.0,Unrated,8.6,2018,1053,"In Romania, ancient forests and expansive wetlands provide habitats to some of Europe's most iconic creatures. Focusing on the Carpathian Mountains and the Danube Delta, this documentary is...                See full summary »",14,10,Romanian,"Romania, UK",10000000,6880917,0,0,0,0,1,51.87179487179487,0,0,0,0,0,0,0,0,0,0,0,0,0,0,0,0,0,0,0,0,0,1,0,0
2191,tt0841119,Lake of Fire,152.0,Unrated,8.2,2006,2438,A graphic documentary on both sides of the abortion debate.,30,46,English,USA,10000000,25317,2559,0,0,0,14,83.0,0,0,0,0,0,0,0,0,0,0,0,0,0,0,0,0,0,0,0,0,0,1,0,0
2192,tt1957945,La Luna,7.0,G,8.0,2011,12655,A young boy helps his father and grandfather harvest stars from the moon.,26,26,None,USA,10000000,6880917,0,0,1,1,1,51.87179487179487,0,0,0,0,0,0,0,0,0,0,0,0,0,0,1,0,0,1,0,0,0,0,0,1
2193,tt2542406,Paradesi,126.0,Unrated,8.0,2013,1638,Before independence during the 1940's depicts the lives of poor carefree villagers who are lured to work in Tea plantation farms and how they are forced to live rest of their lives as slaves with no traces of hope and freedom.,21,4,Tamil,India,120000000,6880917,0,0,0,8,11,51.87179487179487,0,1,0,0,0,0,0,0,0,0,0,0,0,0,0,1,0,0,0,0,0,0,0,0
2194,tt1425244,Partly Cloudy,6.0,G,8.2,2009,19412,"Babies both human and beast are created up in the stratosphere, by the clouds themselves. One cloud specializes in ""dangerous"" babies, creating a challenge for his loyal stork that has to deliver them.",26,9,None,USA,10000000,6880917,0,0,0,0,0,51.87179487179487,0,0,0,1,0,0,0,0,0,0,0,0,0,0,0,0,0,1,0,0,0,0,0,1
2195,tt5084198,Kizumonogatari III: Reiketsu hen,83.0,Unrated,8.0,2017,1381,"Part 3 of Kizumonogatari (Wound Tale) trilogy, based on a light novel by Nisio Isin.",4,5,Japanese,Japan,10000000,6880917,0,0,0,0,0,51.87179487179487,0,1,0,0,0,1,0,0,0,0,0,0,0,0,0,0,0,1,0,0,0,0,0,0
2196,tt0375878,Kaakha..Kaakha: The Police,153.0,Unrated,8.0,2003,4423,"After a police team kills his brother, a drug-dealing gangster vows to kill the entire team and their respective families.",13,2,Tamil,India,50000000,6880917,0,0,0,6,4,51.87179487179487,1,1,0,0,0,1,0,0,0,0,0,0,0,0,0,0,0,0,0,0,0,0,0,0
2197,tt0011541,One Week,25.0,TV-G,8.1,1920,6723,"A newly wedded couple attempts to build a house with a prefabricated kit, unaware that a rival sabotaged the kit's component numbering.",38,16,English,USA,10000000,6880917,0,0,0,1,1,51.87179487179487,0,0,0,1,0,0,0,0,0,0,0,0,0,0,0,0,0,0,0,0,0,0,0,1
2198,tt0099729,Hamoun,120.0,Unrated,8.1,1990,6102,"Hamoon's wife is leaving him. He is also unsuccessfully trying to finish his Ph.D. thesis. He is forced to reexamine his life. In a series of flashbacks and dreams, Hamoon tries to figure ...                See full summary »",4,10,Persian,Iran,10000000,6880917,0,0,0,5,1,51.87179487179487,0,1,0,0,0,0,0,0,0,0,0,0,0,0,0,0,0,0,0,0,0,0,0,0
2199,tt10312668,Tell No One,121.0,Unrated,8.5,2019,2584,The documentary follows the true and elaborate depiction of pedophilia in the Polish Catholic Church.,4,3,Polish,Poland,10000000,6880917,0,0,0,2,0,51.87179487179487,0,0,0,0,0,0,0,0,0,0,0,0,0,0,0,0,0,0,0,0,0,1,0,0
2200,tt2215151,Inequality for All,89.0,PG,8.1,2013,6467,A documentary that follows former U.S. Labor Secretary Robert Reich as he looks to raise awareness of the country's widening economic gap.,36,34,English,USA,10000000,1205273,140888,0,0,2,5,68.0,0,0,0,0,0,0,0,0,0,0,0,0,0,0,0,0,0,0,0,0,0,1,0,0
